text,cleaned,preprocessed
"Grap family keep safe,;;;;",grap family keep safe ,grap family keep safe
Key insights effect COVID - consumer behavior:;;;;,key insights effect covid consumer behavior ,key insights effect covid consumer behavior
"Chemists selling Masks Sanitizers damn high prices , less spreading COVID- , Vibhishans Country .;;;;",chemists selling masks sanitizers damn high prices less spreading covid vibhishans country ,chemists selling masks sanitizers damn high prices less spreading covid vibhishans country
Oil Prices Jump Over % After Top Producers Agree Output Cuts Amid Coronavirus Pandemic;;;;,oil prices jump over after top producers agree output cuts amid coronavirus pandemic ,oil prices jump top producers agree output cuts amid coronavirus pandemic
"Worldwide fuel consumption roughly % COVID- pandemic killed , people worldwide kept businesses governments lockdown;;;;",worldwide fuel consumption roughly covid pandemic killed people worldwide kept businesses governments lockdown ,worldwide fuel consumption roughly covid pandemic killed people worldwide kept businesses governments lockdown
Why difficult people listen reminder social distancing measures place supermarket shop? From looks people need constantly reminding stay apart. Please stop rude &amp; listen thank;;;,why difficult people listen reminder social distancing measures place supermarket shop from looks people need constantly reminding stay apart please stop rude amp listen thank ,difficult people listen reminder social distancing measures place supermarket shop looks people need constantly reminding stay apart please stop rude amp listen thank
Why wouldnÂt govt buy food &amp; pay beleaguered airlines fly itÂs needed? Probably costs less measures &amp; puts people back work &amp; gets food itÂs needed. &amp;demand,why wouldnt govt buy food amp pay beleaguered airlines fly its needed probably costs less measures amp puts people back work amp gets food its needed amp demand,wouldnt govt buy food amp pay beleaguered airlines fly needed probably costs less measures amp puts people back work amp gets food needed amp demand
"STARTING TONIGHT ticket, also face mask ? going required want board NJ transit. Gov Murphy expanding exec order cover face covid pandemic: stores, supermarket, restaurants (for pick up), +public transportation philly;;;;",starting tonight ticket also face mask going required want board nj transit gov murphy expanding exec order cover face covid pandemic stores supermarket restaurants for pick up public transportation philly ,starting tonight ticket also face mask going required want board nj transit gov murphy expanding exec order cover face covid pandemic stores supermarket restaurants pick public transportation philly
"WE NEED COVID- TESTING FOR EVERYONE TODAY! I never afraid leave house trip grocery store life. Now I am. I want bring home virus loved ones. It's me, them.;;;;",we need covid testing for everyone today i never afraid leave house trip grocery store life now i am i want bring home virus loved ones it s me them ,need covid testing everyone today never afraid leave house trip grocery store life want bring home virus loved ones
Container shipping stock prices full retreat early March witnessing market storm stock markets around world sold amp investors struggled calculate economic fallout COVID This fear event;;;;,container shipping stock prices full retreat early march witnessing market storm stock markets around world sold amp investors struggled calculate economic fallout covid this fear event ,container shipping stock prices full retreat early march witnessing market storm stock markets around world sold amp investors struggled calculate economic fallout covid fear event
I canÂt wait go shopping like actual store. Online shopping anymore.;;;;,i cant wait go shopping like actual store online shopping anymore ,cant wait go shopping like actual store online shopping anymore
"# ply ready stock good quality surgical face mask, thermometer, hand sanitizer ready distribute need. Please contact interested buy. Email syima .com;;;;", ply ready stock good quality surgical face mask thermometer hand sanitizer ready distribute need please contact interested buy email syima com ,ply ready stock good quality surgical face mask thermometer hand sanitizer ready distribute need please contact interested buy email syima com
likeit Gallinago Gel cocaine hiked prices cos COVID SNP TV night sturgeon amp COVID chat showed people concerned junkies getting fix every day cos COVID amp price hikes cocaine etc making things harder Junkie Land;;;;,likeit gallinago gel cocaine hiked prices cos covid snp tv night sturgeon amp covid chat showed people concerned junkies getting fix every day cos covid amp price hikes cocaine etc making things harder junkie land ,likeit gallinago gel cocaine hiked prices cos covid snp tv night sturgeon amp covid chat showed people concerned junkies getting fix every day cos covid amp price hikes cocaine etc making things harder junkie land
Lockdowns world reduced demand fuel led crash prices recent days;;;;,lockdowns world reduced demand fuel led crash prices recent days ,lockdowns world reduced demand fuel led crash prices recent days
Is overuse hand going lead new problems like ?;;;;,is overuse hand going lead new problems like ,overuse hand going lead new problems like
"n Pretty good, prices dividends still paid bar one company (a bank), scrapped dividends due COVID- I invest long term dividend. Stay safe..;;;;",n pretty good prices dividends still paid bar one company a bank scrapped dividends due covid i invest long term dividend stay safe ,n pretty good prices dividends still paid bar one company bank scrapped dividends due covid invest long term dividend stay safe
could harder find amid;;;;,could harder find amid ,could harder find amid
Sentiment Asia covid- situation;;;;,sentiment asia covid situation ,sentiment asia covid situation
As pandemic continues many community might become food insecure due loss income inability stock food So Dr Debbie Dougherty many scholars suggestions;;;;,as pandemic continues many community might become food insecure due loss income inability stock food so dr debbie dougherty many scholars suggestions ,pandemic continues many community might become food insecure due loss income inability stock food dr debbie dougherty many scholars suggestions
"The government told I walk around grocery store, based models &amp; research Im sure % accurate. I would never question them, Im sure ONLY best intentions heart.;;;;",the government told i walk around grocery store based models amp research im sure accurate i would never question them im sure only best intentions heart ,government told walk around grocery store based models amp research im sure accurate would never question im sure best intentions heart
"released video taking shoppers inside warehouse Kilcock, Co. Kildare brilliant staff work tirelessly keep supermarket shelves stocked lockdown.....;;;;",released video taking shoppers inside warehouse kilcock co kildare brilliant staff work tirelessly keep supermarket shelves stocked lockdown ,released video taking shoppers inside warehouse kilcock co kildare brilliant staff work tirelessly keep supermarket shelves stocked lockdown
"Each one work one week hospital Queens grocery store drug store May telling rest country do. BTW, need bring PPE. I hear there's shortage.;;;;",each one work one week hospital queens grocery store drug store may telling rest country do btw need bring ppe i hear there s shortage ,one work one week hospital queens grocery store drug store may telling rest country btw need bring ppe hear shortage
"National Markets: Normal Supply, Stable Prices;;;;",national markets normal supply stable prices ,national markets normal supply stable prices
?Funny people filled house groceries still end going grocery store every week! ? ÂÂÂÂÂÂÂÂÂÂÂÂÂÂÂ;;;;, funny people filled house groceries still end going grocery store every week  ,funny people filled house groceries still end going grocery store every week
Check Food &amp; Agribusiness On-Demand Webinar intended share evidence-based information COVID- help agricultural producers identify strategies responding farm.;;;,check food amp agribusiness on demand webinar intended share evidence based information covid help agricultural producers identify strategies responding farm ,check food amp agribusiness demand webinar intended share evidence based information covid help agricultural producers identify strategies responding farm
"Thanks kind words! ????? ""Item described. Happy purchase."" hlor;;;;",thanks kind words item described happy purchase hlor ,thanks kind words item described happy purchase hlor
Is ? article real? Did fact check measures implemented? Firsthand account indicates masks avail workers &amp; w/avg store k sqft thatÂs ppl time shopping whatever hell want;;;,is article real did fact check measures implemented firsthand account indicates masks avail workers amp w avg store k sqft thats ppl time shopping whatever hell want ,article real fact check measures implemented firsthand account indicates masks avail workers amp w avg store k sqft thats ppl time shopping whatever hell want
I ordered new COVID- Protective Suit Specialty Store online wear I go shopping... ?;;;;,i ordered new covid protective suit specialty store online wear i go shopping ,ordered new covid protective suit specialty store online wear go shopping
One Portland CBD retailer got trouble Oregon Attorney General falsely claiming products store cure COVID For much go;;;;,one portland cbd retailer got trouble oregon attorney general falsely claiming products store cure covid for much go ,one portland cbd retailer got trouble oregon attorney general falsely claiming products store cure covid much go
Grocery Store Workers Are Dying New Laws Are Forcing Companies Protect Them;;;;,grocery store workers are dying new laws are forcing companies protect them ,grocery store workers dying new laws forcing companies protect
"So disturbing SA buying PPE needed protect virus ex China. Government spending millions buy masks, thermometers... China, corrupt procurement officials inflating prices benefit. C;;;;",so disturbing sa buying ppe needed protect virus ex china government spending millions buy masks thermometers china corrupt procurement officials inflating prices benefit c ,disturbing sa buying ppe needed protect virus ex china government spending millions buy masks thermometers china corrupt procurement officials inflating prices benefit c
"Remember campaign closing argument ? And March Âtrade wars good, easy winÂ ? With , Deaths, still fighting;;;;",remember campaign closing argument and march trade wars good easy win with deaths still fighting ,remember campaign closing argument march trade wars good easy win deaths still fighting
"""Attitudes major purchases improved slightly. The American consumer doesnÂt like wait."" -;;;;", attitudes major purchases improved slightly the american consumer doesnt like wait ,attitudes major purchases improved slightly american consumer doesnt like wait
You know lockdown getting much youÂve enough online shopping. Not whole waiting - weeks delivery either ?? oflockdown;;;;,you know lockdown getting much youve enough online shopping not whole waiting weeks delivery either oflockdown ,know lockdown getting much youve enough online shopping whole waiting weeks delivery either oflockdown
"Opec, Russia approve biggest-ever oil cut support prices amid Covid- pandemic | Malay Mail;;;;",opec russia approve biggest ever oil cut support prices amid covid pandemic malay mail ,opec russia approve biggest ever oil cut support prices amid covid pandemic malay mail
"So lonely quarantine ? @ St. Louis, Missouri;;;;",so lonely quarantine st louis missouri ,lonely quarantine st louis missouri
The - pandemic led jump online shopping sharp rise credit card . Via;;;;,the pandemic led jump online shopping sharp rise credit card via ,pandemic led jump online shopping sharp rise credit card via
When forget wear mask grocery store need create self isolation forcefield bubble ?;;;;,when forget wear mask grocery store need create self isolation forcefield bubble ,forget wear mask grocery store need create self isolation forcefield bubble
"DST supports start-up make natural, alcohol-free sanitizer Read More: updates;;;;",dst supports start up make natural alcohol free sanitizer read more updates ,dst supports start make natural alcohol free sanitizer read updates
workers offered jobs bid keep supermarket shelves stocked Workers lost jobs result COVID offered new employment amp training initiative launched;;;;,workers offered jobs bid keep supermarket shelves stocked workers lost jobs result covid offered new employment amp training initiative launched ,workers offered jobs bid keep supermarket shelves stocked workers lost jobs result covid offered new employment amp training initiative launched
"ÂWe created interactive map direct-to-consumer brands based NYC illustrate true creative energy city, way coronavirus way return soon.Â - Chris Nager;;;;",we created interactive map direct to consumer brands based nyc illustrate true creative energy city way coronavirus way return soon  chris nager ,created interactive map direct consumer brands based nyc illustrate true creative energy city way coronavirus way return soon chris nager
"Still, even production cut size large enough offset -induced demand shock, prices could tumble coming weeks inventories rise.;;;;",still even production cut size large enough offset induced demand shock prices could tumble coming weeks inventories rise ,still even production cut size large enough offset induced demand shock prices could tumble coming weeks inventories rise
"The casualties war. hawaii_street_photography @ Honolulu,Â;;;;",the casualties war hawaii street photography honolulu  ,casualties war hawaii street photography honolulu
"Two Orlando devs built app crowdsources information give shoppers better idea what's local grocery store, limiting time people risk exposure .;;;;",two orlando devs built app crowdsources information give shoppers better idea what s local grocery store limiting time people risk exposure ,two orlando devs built app crowdsources information give shoppers better idea local grocery store limiting time people risk exposure
Hi - seems pretty clear supermarkets likely one main places transmission covid . When be: a) providing PPE staff&amp;customers; b) prioritising clock&amp;collect; c) sorting home delivery mess?,hi seems pretty clear supermarkets likely one main places transmission covid when be a providing ppe staff amp customers b prioritising clock amp collect c sorting home delivery mess ,hi seems pretty clear supermarkets likely one main places transmission covid providing ppe staff amp customers b prioritising clock amp collect c sorting home delivery mess
Sometimes need help... Words real;;;;,sometimes need help words real ,sometimes need help words real
Thought walk direction someone confined space supermarket safe distance enough see research study running behind someone;;;;,thought walk direction someone confined space supermarket safe distance enough see research study running behind someone ,thought walk direction someone confined space supermarket safe distance enough see research study running behind someone
"After generous donation me, I able bless several people today grocery store gift cards. And course I matched donation I could help even people food needs difficult time. WeÂre stronger together.;;;;",after generous donation me i able bless several people today grocery store gift cards and course i matched donation i could help even people food needs difficult time were stronger together ,generous donation able bless several people today grocery store gift cards course matched donation could help even people food needs difficult time stronger together
Survey: Asian consumer sentiment coronavirus crisis | McKinsey;;;;,survey asian consumer sentiment coronavirus crisis mckinsey ,survey asian consumer sentiment coronavirus crisis mckinsey
"US prices post steepest plunge five years forced lockdown drags on. ""The big concern right deflation,"" 's chief economist -;;;;",us prices post steepest plunge five years forced lockdown drags on the big concern right deflation s chief economist ,us prices post steepest plunge five years forced lockdown drags big concern right deflation chief economist
"Covid- shines light underappreciated workers world: cleaning staff, supermarket cashiers, truckers...I hope value way over.;;;;",covid shines light underappreciated workers world cleaning staff supermarket cashiers truckers i hope value way over ,covid shines light underappreciated workers world cleaning staff supermarket cashiers truckers hope value way
How different recession Picture shows consumer sectors resilient producing capital goods This time course lock downs make picture different bounce back could follow along lines;;;;,how different recession picture shows consumer sectors resilient producing capital goods this time course lock downs make picture different bounce back could follow along lines ,different recession picture shows consumer sectors resilient producing capital goods time course lock downs make picture different bounce back could follow along lines
Going days ? ? (Me)?? #????_?????? #??_????;;;;,going days me ,going days
How Make Clorox Bleach Wipes &amp; DIY Hand Sanitizer (+ Advice From Doctor) This best recipes;;;,how make clorox bleach wipes amp diy hand sanitizer advice from doctor this best recipes ,make clorox bleach wipes amp diy hand sanitizer advice doctor best recipes
Is meat next American consumer hoarding focus?;;;;,is meat next american consumer hoarding focus ,meat next american consumer hoarding focus
"Going out? Be sure protected. Face mask, safety goggles (you've got vulnerable mucous membranes eyes), sanitizer, sun block (always good idea), non-slip shoes, helmet, condom, catholic guilt, bear spray, full coverage insurance everything.;;;;",going out be sure protected face mask safety goggles you ve got vulnerable mucous membranes eyes sanitizer sun block always good idea non slip shoes helmet condom catholic guilt bear spray full coverage insurance everything ,going sure protected face mask safety goggles got vulnerable mucous membranes eyes sanitizer sun block always good idea non slip shoes helmet condom catholic guilt bear spray full coverage insurance everything
The Consumer Financial Protection Bureau provided guidance canÂt pay mortgage options available part Cares Act signed law March .;;;;,the consumer financial protection bureau provided guidance cant pay mortgage options available part cares act signed law march ,consumer financial protection bureau provided guidance cant pay mortgage options available part cares act signed law march
"Deals buy indy practices less upfront backended. COVID- throws curve ball RIA M&amp;A market, gut-punching valuations causing fence-sitters resolve get hell out, Q prices hold;;;;",deals buy indy practices less upfront backended covid throws curve ball ria m amp a market gut punching valuations causing fence sitters resolve get hell out q prices hold ,deals buy indy practices less upfront backended covid throws curve ball ria amp market gut punching valuations causing fence sitters resolve get hell q prices hold
"At , access multiple datasets data products track consumer behavior, demographic profiles, details help understand sectors impacted hardest.;;;;",at access multiple datasets data products track consumer behavior demographic profiles details help understand sectors impacted hardest ,access multiple datasets data products track consumer behavior demographic profiles details help understand sectors impacted hardest
"Is next consumer focus? So happy I went full plant-based diet last year. On bright side, maybe take focus toilet paper hoarding.;;;;",is next consumer focus so happy i went full plant based diet last year on bright side maybe take focus toilet paper hoarding ,next consumer focus happy went full plant based diet last year bright side maybe take focus toilet paper hoarding
"$ , And IÂll give address.;;;;", and ill give address ,ill give address
Supermarket entry quiz: Do know means? ?;;;;,supermarket entry quiz do know means ,supermarket entry quiz know means
Thank . . raising awareness pressure care homes face fight Âthe virus spread homes like wildfire staff arenÂt given personal protective equipmentÂ;;;;,thank raising awareness pressure care homes face fight the virus spread homes like wildfire staff arent given personal protective equipment ,thank raising awareness pressure care homes face fight virus spread homes like wildfire staff arent given personal protective equipment
"Ethanol Producers Feeling Weight Low Oil Prices, Covid- Pandemic;;;;",ethanol producers feeling weight low oil prices covid pandemic ,ethanol producers feeling weight low oil prices covid pandemic
Goldman Sachs still sees crude prices falling OPEC+ deal $spx $spy $tsla $tslaq $dis $aapl $xlf;;;;,goldman sachs still sees crude prices falling opec deal spx spy tsla tslaq dis aapl xlf ,goldman sachs still sees crude prices falling opec deal spx spy tsla tslaq dis aapl xlf
Blue Dart Express reduces retail tariff prices Company reduces Retail Tariff prices medical medical instrument aiding nation fight COVID Pandemic Outbreak;;;;,blue dart express reduces retail tariff prices company reduces retail tariff prices medical medical instrument aiding nation fight covid pandemic outbreak ,blue dart express reduces retail tariff prices company reduces retail tariff prices medical medical instrument aiding nation fight covid pandemic outbreak
Consumer demand online shopping hyperdrive due How brands getting prepared next stage We recommend story;;;;,consumer demand online shopping hyperdrive due how brands getting prepared next stage we recommend story ,consumer demand online shopping hyperdrive due brands getting prepared next stage recommend story
Paul Krugman Bashes Trump Scheme To Boost Oil Profits While Stonewalling Post Office Aid;;;;,paul krugman bashes trump scheme to boost oil profits while stonewalling post office aid ,paul krugman bashes trump scheme boost oil profits stonewalling post office aid
"better cut data prices.. We got another days.. . gb last days hours, mins seconds ?? ..;;;;",better cut data prices we got another days gb last days hours mins seconds ,better cut data prices got another days gb last days hours mins seconds
"I buy Smithfield's meat,because known inhumane practices. Still,this proves essential workers higher risk contracting &amp; impacting farmer;;;;",i buy smithfield s meat because known inhumane practices still this proves essential workers higher risk contracting amp impacting farmer ,buy smithfield meat known inhumane practices still proves essential workers higher risk contracting amp impacting farmer
"ÂThereÂs authorized home testing kit essentially someone wants sell kit, itÂs fake donÂt purchase it.Â;;;;",theres authorized home testing kit essentially someone wants sell kit its fake dont purchase it  ,theres authorized home testing kit essentially someone wants sell kit fake dont purchase
Uranium enters bull market Covid- hits supply Prices rebound March lows miner Kazatomprom slashes production;;;;,uranium enters bull market covid hits supply prices rebound march lows miner kazatomprom slashes production ,uranium enters bull market covid hits supply prices rebound march lows miner kazatomprom slashes production
Id really like see someone make donation sort Grocery Convenience store workers. They're working hard risk Healthcare professionals.;;;;,id really like see someone make donation sort grocery convenience store workers they re working hard risk healthcare professionals ,id really like see someone make donation sort grocery convenience store workers working hard risk healthcare professionals
"Unnamed supermarket angered (quick, essential) weekly shop. Two members staff standing *so* close other. When I pointed got shouted Âwe canÂt roster without standing together.Â Beyond belief.;;;;",unnamed supermarket angered quick essential weekly shop two members staff standing so close other when i pointed got shouted we cant roster without standing together  beyond belief ,unnamed supermarket angered quick essential weekly shop two members staff standing close pointed got shouted cant roster without standing together beyond belief
"Interestingly, one watches Hollywood films wonders zero &amp; use sanitizer clean hands accepting picture album someone!!! Of course future last thing minds ?!;;;;",interestingly one watches hollywood films wonders zero amp use sanitizer clean hands accepting picture album someone of course future last thing minds ,interestingly one watches hollywood films wonders zero amp use sanitizer clean hands accepting picture album someone course future last thing minds
"In response shifting consumer spending COVID- , non-food retailers furloughing employees food retailers forced close stores production facilities due infections, resulting innovative actions industry.;;;;",in response shifting consumer spending covid non food retailers furloughing employees food retailers forced close stores production facilities due infections resulting innovative actions industry ,response shifting consumer spending covid non food retailers furloughing employees food retailers forced close stores production facilities due infections resulting innovative actions industry
