text,cleaned,preprocessed
but the smell is different.;;;;,but the smell is different ,smell different
"yes, old people don't smell like fruit.;;;;",yes old people don t smell like fruit ,yes old people smell like fruit
"no, they smell like a thrift shop.;;;;",no they smell like a thrift shop ,smell like thrift shop
"yes, a thrift shop has that same smell.;;;;",yes a thrift shop has that same smell ,yes thrift shop smell
the price of stamps goes up and up.;;;;,the price of stamps goes up and up ,price stamps goes
i think stamps used to cost a penny.;;;;,i think stamps used to cost a penny ,think stamps used cost penny
that was a long time ago.;;;;,that was a long time ago ,long time ago
it was before i was born.;;;;,it was before i was born ,born
now a stamp is 42 cents.;;;;,now a stamp is cents ,stamp cents
but in may it will be 44 cents.;;;;,but in may it will be cents ,may cents
have you ever lost a letter in the mail?;;;;,have you ever lost a letter in the mail ,ever lost letter mail
"no, i haven't.;;;;",no i haven t ,
neither have i.;;;;,neither have i ,neither
"so, they do a good job for the money.;;;;",so they do a good job for the money ,good job money
"yes, they do.;;;;",yes they do ,yes
a button came off my shirt.;;;;,a button came off my shirt ,button came shirt
what are you going to do?;;;;,what are you going to do ,going
"first, i have to find the button.;;;;",first i have to find the button ,first find button
where did you lose it?;;;;,where did you lose it ,lose
i have no idea.;;;;,i have no idea ,idea
a button is hard to find. did you look in your pant cuffs?;;;;,a button is hard to find did you look in your pant cuffs ,button hard find look pant cuffs
that's a good idea.;;;;,that s a good idea ,good idea
i found a button in my pant cuffs one time.;;;;,i found a button in my pant cuffs one time ,found button pant cuffs one time
"let me look. no, it's not there.;;;;",let me look no it s not there ,let look
many shirts come with an extra button.;;;;,many shirts come with an extra button ,many shirts come extra button
you're right. this one does have an extra button.;;;;,you re right this one does have an extra button ,right one extra button
i have to go to the bathroom.;;;;,i have to go to the bathroom ,go bathroom
you drink too much coffee.;;;;,you drink too much coffee ,drink much coffee
but i love coffee.;;;;,but i love coffee ,love coffee
"well, it's your life.;;;;",well it s your life ,well life
you eat too much chocolate.;;;;,you eat too much chocolate ,eat much chocolate
i don't think so.;;;;,i don t think so ,think
have you looked in the mirror?;;;;,have you looked in the mirror ,looked mirror
do you think i'm getting fat?;;;;,do you think i m getting fat ,think getting fat
i didn't say that.;;;;,i didn t say that ,say
what did you say?;;;;,what did you say ,say
i said i have to go to the bathroom.;;;;,i said i have to go to the bathroom ,said go bathroom
did you do the laundry?;;;;,did you do the laundry ,laundry
"yes, i did.;;;;",yes i did ,yes
what did you wash?;;;;,what did you wash ,wash
i washed the sheets and towels.;;;;,i washed the sheets and towels ,washed sheets towels
what about the pillowcases?;;;;,what about the pillowcases ,pillowcases
"yes, i took them off the pillows and washed them.;;;;",yes i took them off the pillows and washed them ,yes took pillows washed
did you dry everything in the dryer?;;;;,did you dry everything in the dryer ,dry everything dryer
"yes, i dried everything in the dryer.;;;;",yes i dried everything in the dryer ,yes dried everything dryer
then what did you do?;;;;,then what did you do ,
i folded all the towels.;;;;,i folded all the towels ,folded towels
did you put the sheets on the beds?;;;;,did you put the sheets on the beds ,put sheets beds
do you listen to the radio?;;;;,do you listen to the radio ,listen radio
i listen day and night.;;;;,i listen day and night ,listen day night
what do you listen to?;;;;,what do you listen to ,listen
mostly talk radio.;;;;,mostly talk radio ,mostly talk radio
what's that?;;;;,what s that ,
people talk about current events.;;;;,people talk about current events ,people talk current events
what do they say?;;;;,what do they say ,say
they say they want change.;;;;,they say they want change ,say want change
what kind of change?;;;;,what kind of change ,kind change
they want tax cuts.;;;;,they want tax cuts ,want tax cuts
why do they want tax cuts?;;;;,why do they want tax cuts ,want tax cuts
"mom, i'm hungry.;;;;",mom i m hungry ,mom hungry
look in the fridge.;;;;,look in the fridge ,look fridge
i'm looking. there's nothing to eat.;;;;,i m looking there s nothing to eat ,looking nothing eat
are you sure?;;;;,are you sure ,sure
it's almost empty.;;;;,it s almost empty ,almost empty
i went to the market yesterday.;;;;,i went to the market yesterday ,went market yesterday
i don't see anything.;;;;,i don t see anything ,see anything
i bought lots of oranges and apples.;;;;,i bought lots of oranges and apples ,bought lots oranges apples
i don't want fruit. i want something tasty.;;;;,i don t want fruit i want something tasty ,want fruit want something tasty
eat the fruit. it's good for you.;;;;,eat the fruit it s good for you ,eat fruit good
"next time you go to the market, let me go with you.;;;;",next time you go to the market let me go with you ,next time go market let go
what is there to eat?;;;;,what is there to eat ,eat
i don't know. look in the fridge.;;;;,i don t know look in the fridge ,know look fridge
i think i'll make a sandwich.;;;;,i think i ll make a sandwich ,think make sandwich
what kind?;;;;,what kind ,kind
a ham sandwich.;;;;,a ham sandwich ,ham sandwich
the bread is in the cabinet.;;;;,the bread is in the cabinet ,bread cabinet
where's the mustard?;;;;,where s the mustard ,mustard
"it's in the fridge, i think.;;;;",it s in the fridge i think ,fridge think
"oh, yes, here it is. do you want a sandwich?;;;;",oh yes here it is do you want a sandwich ,oh yes want sandwich
"yes, that sounds nice.;;;;",yes that sounds nice ,yes sounds nice
how about some potato chips?;;;;,how about some potato chips ,potato chips
"it's time for your bath, young lady.;;;;",it s time for your bath young lady ,time bath young lady
"but, mom, i'm not dirty.;;;;",but mom i m not dirty ,mom dirty
you need a bath every day.;;;;,you need a bath every day ,need bath every day
why?;;;;,why ,
because you don't want to smell bad.;;;;,because you don t want to smell bad ,want smell bad
i don't smell bad.;;;;,i don t smell bad ,smell bad
that's what you think.;;;;,that s what you think ,think
"if i smelled bad, i could smell me.;;;;",if i smelled bad i could smell me ,smelled bad could smell
i can smell you.;;;;,i can smell you ,smell
"i can smell you, too.;;;;",i can smell you too ,smell
that's my perfume.;;;;,that s my perfume ,perfume
something's wrong with my computer.;;;;,something s wrong with my computer ,something wrong computer
exactly what?;;;;,exactly what ,exactly
all i get is a black screen.;;;;,all i get is a black screen ,get black screen
what's the matter?;;;;,what s the matter ,matter
"i think i know, because this happened before.;;;;",i think i know because this happened before ,think know happened
what happened before?;;;;,what happened before ,happened
my hard drive crashed.;;;;,my hard drive crashed ,hard drive crashed
"oh, no. that's bad news.;;;;",oh no that s bad news ,oh bad news
"it sure is, but i'm going to call hp first, just to make sure.;;;;",it sure is but i m going to call hp first just to make sure ,sure going call hp first make sure
will you lose all your files?;;;;,will you lose all your files ,lose files
"no, i always back up my files.;;;;",no i always back up my files ,always back files
i called hp about my computer.;;;;,i called hp about my computer ,called hp computer
what did they say?;;;;,what did they say ,say
they said i need a new hard drive.;;;;,they said i need a new hard drive ,said need new hard drive
that's too bad. how much is a new one?;;;;,that s too bad how much is a new one ,bad much new one
"it's not too much, only about $85.;;;;",it s not too much only about ,much
plus installation?;;;;,plus installation ,plus installation
"no, my hard drive is easy to remove and replace.;;;;",no my hard drive is easy to remove and replace ,hard drive easy remove replace
really?;;;;,really ,really
"yes, it's just a couple of screws.;;;;",yes it s just a couple of screws ,yes couple screws
that's nice.;;;;,that s nice ,nice
it's a lot better than paying someone $60.;;;;,it s a lot better than paying someone ,lot better paying someone
what's your email address?;;;;,what s your email address ,email address
it's bluedog123.;;;;,it s bluedog ,bluedog
bluedog123. are you sure that's all?;;;;,bluedog are you sure that s all ,bluedog sure
yes.;;;;,yes ,yes
no. that's incomplete.;;;;,no that s incomplete ,incomplete
what do you mean?;;;;,what do you mean ,mean
what's your mailing address?;;;;,what s your mailing address ,mailing address
"456 cherry drive, pasadena, ca 91170.;;;;", cherry drive pasadena ca ,cherry drive pasadena ca
that's correct.;;;;,that s correct ,correct
so what's the problem?;;;;,so what s the problem ,problem
"bluedog123 is just the street. you have to give me the city, state, and zip code.;;;;",bluedog is just the street you have to give me the city state and zip code ,bluedog street give city state zip code
i'm going to take a nap.;;;;,i m going to take a nap ,going take nap
you should unplug the phone.;;;;,you should unplug the phone ,unplug phone
that's a good idea.;;;;,that s a good idea ,good idea
do you want me to wake you in an hour?;;;;,do you want me to wake you in an hour ,want wake hour
"no, thanks. just let me sleep until i wake up.;;;;",no thanks just let me sleep until i wake up ,thanks let sleep wake
i'll start dinner at 6:00.;;;;,i ll start dinner at ,start dinner
okay. i think i'll be awake by then.;;;;,okay i think i ll be awake by then ,okay think awake
"if not, your nose will wake you up.;;;;",if not your nose will wake you up ,nose wake
you mean i will smell the food cooking?;;;;,you mean i will smell the food cooking ,mean smell food cooking
you might even dream about dinner.;;;;,you might even dream about dinner ,might even dream dinner
i don't think i'm going to dream about anything. i'm really tired.;;;;,i don t think i m going to dream about anything i m really tired ,think going dream anything really tired
that was a nice funeral.;;;;,that was a nice funeral ,nice funeral
"yes, dad, it was.;;;;",yes dad it was ,yes dad
the son gave a nice speech about his father.;;;;,the son gave a nice speech about his father ,son gave nice speech father
"it was long, too.;;;;",it was long too ,long
i think it was about 45 minutes long.;;;;,i think it was about minutes long ,think minutes long
but it went by fast. it was interesting.;;;;,but it went by fast it was interesting ,went fast interesting
i liked it.;;;;,i liked it ,liked
"i'll give you a speech like that, too.;;;;",i ll give you a speech like that too ,give speech like
do you think anyone will come to my funeral?;;;;,do you think anyone will come to my funeral ,think anyone come funeral
of course.;;;;,of course ,course
i think only the family will be there.;;;;,i think only the family will be there ,think family
yikes! what was that noise?;;;;,yikes what was that noise ,yikes noise
i had to blow my nose.;;;;,i had to blow my nose ,blow nose
did you have to blow right next to the phone?;;;;,did you have to blow right next to the phone ,blow right next phone
did you hear that?;;;;,did you hear that ,hear
of course i heard that. i thought a plane had crashed into your house.;;;;,of course i heard that i thought a plane had crashed into your house ,course heard thought plane crashed house
it wasn't that loud.;;;;,it wasn t that loud ,loud
"i will blow my nose sometime for you, and you'll see.;;;;",i will blow my nose sometime for you and you ll see ,blow nose sometime see
okay. i'll take your word for it.;;;;,okay i ll take your word for it ,okay take word
i thought you had an elephant in your house.;;;;,i thought you had an elephant in your house ,thought elephant house
you're funny.;;;;,you re funny ,funny
what did you say? i think i've gone deaf.;;;;,what did you say i think i ve gone deaf ,say think gone deaf
i have lots of friends.;;;;,i have lots of friends ,lots friends
really? how many do you have?;;;;,really how many do you have ,really many
"i don't know, maybe one hundred.;;;;",i don t know maybe one hundred ,know maybe one hundred
that is a lot of friends. do you have a best friend?;;;;,that is a lot of friends do you have a best friend ,lot friends best friend
of course. i have lots of best friends.;;;;,of course i have lots of best friends ,course lots best friends
how many best friends do you have?;;;;,how many best friends do you have ,many best friends
i think about twenty-five.;;;;,i think about twenty five ,think twenty five
hmm. i have only one best friend.;;;;,hmm i have only one best friend ,hmm one best friend
i feel sorry for you.;;;;,i feel sorry for you ,feel sorry
i have only a few friends.;;;;,i have only a few friends ,friends
you must be lonely. i will share my friends with you.;;;;,you must be lonely i will share my friends with you ,must lonely share friends
don't you ever cheat on me.;;;;,don t you ever cheat on me ,ever cheat
why would i do that?;;;;,why would i do that ,would
because men like to cheat.;;;;,because men like to cheat ,men like cheat
"some men do, but not me.;;;;",some men do but not me ,men
i'm watching you.;;;;,i m watching you ,watching
i'm an open book. watch me all you want.;;;;,i m an open book watch me all you want ,open book watch want
"if i catch you, you'll be sorry.;;;;",if i catch you you ll be sorry ,catch sorry
"you won't catch me, because i love you. i'm not a cheater.;;;;",you won t catch me because i love you i m not a cheater ,catch love cheater
i will poke your eyes out. ;;;;,i will poke your eyes out ,poke eyes
i don't want any other woman.;;;;,i don t want any other woman ,want woman
"i will chop your toes off, one by one.;;;;",i will chop your toes off one by one ,chop toes one one
i hate to go outside.;;;;,i hate to go outside ,hate go outside
me too.;;;;,me too ,
why do you hate to go outside?;;;;,why do you hate to go outside ,hate go outside
i meet too many jerks.;;;;,i meet too many jerks ,meet many jerks
i agree.;;;;,i agree ,agree
this city is full of jerks.;;;;,this city is full of jerks ,city full jerks
rude people are everywhere.;;;;,rude people are everywhere ,rude people everywhere
but what can you do?;;;;,but what can you do ,
you can yell at them.;;;;,you can yell at them ,yell
and they will yell back at you.;;;;,and they will yell back at you ,yell back
yelling doesn't do any good.;;;;,yelling doesn t do any good ,yelling good
will you look at this form?;;;;,will you look at this form ,look form
are you having problems with it?;;;;,are you having problems with it ,problems
i don't understand some things.;;;;,i don t understand some things ,understand things
let me help you.;;;;,let me help you ,let help
"what does ""mi"" mean?;;;;",what does mi mean ,mi mean
"""mi"" stands for middle initial.;;;;", mi stands for middle initial ,mi stands middle initial
"what does ""mm/dd/yy"" mean?;;;;",what does mm dd yy mean ,mm dd yy mean
that means month/day/year. use numbers.;;;;,that means month day year use numbers ,means month day year use numbers
i don't understand.;;;;,i don t understand ,understand
"for example, if your birth date is january 12, 1987, write 01/12/87.;;;;",for example if your birth date is january write ,example birth date january write
oh. that's simple enough.;;;;,oh that s simple enough ,oh simple enough
let's go to the animal shelter.;;;;,let s go to the animal shelter ,let go animal shelter
what do you want to do?;;;;,what do you want to do ,want
i want to get a puppy for my son.;;;;,i want to get a puppy for my son ,want get puppy son
that will make him so happy.;;;;,that will make him so happy ,make happy
i'll get him one of those little dogs.;;;;,i ll get him one of those little dogs ,get one little dogs
one that won't grow up too big.;;;;,one that won t grow up too big ,one grow big
and eat too much.;;;;,and eat too much ,eat much
do you know which one he would like?;;;;,do you know which one he would like ,know one would like
"oh, yes, i took him there yesterday. he showed me one that he really liked.;;;;",oh yes i took him there yesterday he showed me one that he really liked ,oh yes took yesterday showed one really liked
i bet you had to drag him away.;;;;,i bet you had to drag him away ,bet drag away
he wanted to take it home yesterday.;;;;,he wanted to take it home yesterday ,wanted take home yesterday
what's the weather like?;;;;,what s the weather like ,weather like
i don't know. i just woke up.;;;;,i don t know i just woke up ,know woke
why don't you look outside?;;;;,why don t you look outside ,look outside
okay. it looks like rain.;;;;,okay it looks like rain ,okay looks like rain
why do you say that?;;;;,why do you say that ,say
the sky is gray.;;;;,the sky is gray ,sky gray
is it raining right now?;;;;,is it raining right now ,raining right
no.;;;;,no ,
how do you know?;;;;,how do you know ,know
the street isn't wet.;;;;,the street isn t wet ,street wet
i have to go shopping today.;;;;,i have to go shopping today ,go shopping today
i can't believe how hot it is.;;;;,i can t believe how hot it is ,believe hot
it's not even noon yet.;;;;,it s not even noon yet ,even noon yet
that means it will get hotter.;;;;,that means it will get hotter ,means get hotter
i am dying from the heat.;;;;,i am dying from the heat ,dying heat
turn on the air conditioner.;;;;,turn on the air conditioner ,turn air conditioner
it doesn't work.;;;;,it doesn t work ,work
what happened?;;;;,what happened ,happened
i don't know.;;;;,i don t know ,know
did you call the repairman?;;;;,did you call the repairman ,call repairman
of course.;;;;,of course ,course
when is he coming?;;;;,when is he coming ,coming
i'll be glad when winter comes.;;;;,i ll be glad when winter comes ,glad winter comes
why is that?;;;;,why is that ,
because i love the snow.;;;;,because i love the snow ,love snow
"yes, the snow is fun.;;;;",yes the snow is fun ,yes snow fun
last year we made a big snowman.;;;;,last year we made a big snowman ,last year made big snowman
how big was it?;;;;,how big was it ,big
it was seven feet tall.;;;;,it was seven feet tall ,seven feet tall
how long did it take?;;;;,how long did it take ,long take
it took us all day.;;;;,it took us all day ,took us day
did you give him a nose?;;;;,did you give him a nose ,give nose
of course. we gave him a big carrot for a nose.;;;;,of course we gave him a big carrot for a nose ,course gave big carrot nose
i'm going to the bank.;;;;,i m going to the bank ,going bank
what do you need to do?;;;;,what do you need to do ,need
i need to withdraw some money.;;;;,i need to withdraw some money ,need withdraw money
how are you going to do that?;;;;,how are you going to do that ,going
i'll just use the atm.;;;;,i ll just use the atm ,use atm
what's that?;;;;,what s that ,
it's the automatic teller machine.;;;;,it s the automatic teller machine ,automatic teller machine
it gives you money?;;;;,it gives you money ,gives money
i just insert my debit card into the machine.;;;;,i just insert my debit card into the machine ,insert debit card machine
and it gives you money?;;;;,and it gives you money ,gives money
"well, it gives me money, but it's my own money.;;;;",well it gives me money but it s my own money ,well gives money money
did you put the blue bin out on the street?;;;;,did you put the blue bin out on the street ,put blue bin street
"oh, no. i forgot.;;;;",oh no i forgot ,oh forgot
"well, you'd better take it out front.;;;;",well you d better take it out front ,well better take front
what time does the recycle truck come by?;;;;,what time does the recycle truck come by ,time recycle truck come
"it usually gets here at noon on tuesday, which is tomorrow.;;;;",it usually gets here at noon on tuesday which is tomorrow ,usually gets noon tuesday tomorrow
i'll just take it out to the street tomorrow morning.;;;;,i ll just take it out to the street tomorrow morning ,take street tomorrow morning
"oh, no, you don't.;;;;",oh no you don t ,oh
what do you mean?;;;;,what do you mean ,mean
every morning you get up late and rush off to work late.;;;;,every morning you get up late and rush off to work late ,every morning get late rush work late
do you think i'll forget to do it?;;;;,do you think i ll forget to do it ,think forget
"you'll remember to do it, but you won't have time to do it.;;;;",you ll remember to do it but you won t have time to do it ,remember time
are you ready?;;;;,are you ready ,ready
ready for what?;;;;,ready for what ,ready
ready for the big switch.;;;;,ready for the big switch ,ready big switch
what are you talking about?;;;;,what are you talking about ,talking
the nation is switching to digital tv.;;;;,the nation is switching to digital tv ,nation switching digital tv
oh. of course i'm ready.;;;;,oh of course i m ready ,oh course ready
did you buy the converter?;;;;,did you buy the converter ,buy converter
"no, i don't need a converter because i bought a digital tv.;;;;",no i don t need a converter because i bought a digital tv ,need converter bought digital tv
how much was that?;;;;,how much was that ,much
it was only about $120 for a 13-inch screen.;;;;,it was only about for a inch screen ,inch screen
does it pick up any digital channels?;;;;,does it pick up any digital channels ,pick digital channels
people are funny.;;;;,people are funny ,people funny
they sure are.;;;;,they sure are ,sure
did you hear about the pilot?;;;;,did you hear about the pilot ,hear pilot
the one that stole a small plane?;;;;,the one that stole a small plane ,one stole small plane
"yes, he stole a plane in canada and flew into the u.s.;;;;",yes he stole a plane in canada and flew into the u s ,yes stole plane canada flew u
did they catch him?;;;;,did they catch him ,catch
"yes. after two u.s. fighter jets followed him for an hour, he landed on a highway.;;;;",yes after two u s fighter jets followed him for an hour he landed on a highway ,yes two u fighter jets followed hour landed highway
did he crash?;;;;,did he crash ,crash
"no, he just landed the plane and walked to a restaurant.;;;;",no he just landed the plane and walked to a restaurant ,landed plane walked restaurant
did the cops find out why he flew into the u.s.?;;;;,did the cops find out why he flew into the u s ,cops find flew u
his life sucked. he was hoping a fighter jet would shoot him down.;;;;,his life sucked he was hoping a fighter jet would shoot him down ,life sucked hoping fighter jet would shoot
the police need our help finding a robber.;;;;,the police need our help finding a robber ,police need help finding robber
how do you know?;;;;,how do you know ,know
the tv news is reporting a bank robbery.;;;;,the tv news is reporting a bank robbery ,tv news reporting bank robbery
do they know what the robber looks like?;;;;,do they know what the robber looks like ,know robber looks like
"yes, he's 6 feet tall, 200 pounds, black hair, and about 30 years old.;;;;",yes he s feet tall pounds black hair and about years old ,yes feet tall pounds black hair years old
what race is he?;;;;,what race is he ,race
they didn't say.;;;;,they didn t say ,say
the tv news doesn't tell us the race anymore.;;;;,the tv news doesn t tell us the race anymore ,tv news tell us race anymore
of course not. that would be racist.;;;;,of course not that would be racist ,course would racist
but how can we identify someone if we don't know their race?;;;;,but how can we identify someone if we don t know their race ,identify someone know race
don't ask me.;;;;,don t ask me ,ask
don't wipe your nose on your sleeve.;;;;,don t wipe your nose on your sleeve ,wipe nose sleeve
but i don't have a tissue.;;;;,but i don t have a tissue ,tissue
then go find a tissue in the bathroom.;;;;,then go find a tissue in the bathroom ,go find tissue bathroom
i didn't have time to get one from there.;;;;,i didn t have time to get one from there ,time get one
your sleeves are not tissues.;;;;,your sleeves are not tissues ,sleeves tissues
"but mom, all my friends use their sleeves.;;;;",but mom all my friends use their sleeves ,mom friends use sleeves
that doesn't make it right.;;;;,that doesn t make it right ,make right
i saw dad wipe his nose on his sleeve yesterday.;;;;,i saw dad wipe his nose on his sleeve yesterday ,saw dad wipe nose sleeve yesterday
i will talk to your father about that.;;;;,i will talk to your father about that ,talk father
i bet dad did it all the time when he was my age.;;;;,i bet dad did it all the time when he was my age ,bet dad time age
your daddy was a good little boy.;;;;,your daddy was a good little boy ,daddy good little boy
i'm worried.;;;;,i m worried ,worried
worried about what?;;;;,worried about what ,worried
i'm getting married.;;;;,i m getting married ,getting married
"you should be happy, not worried.;;;;",you should be happy not worried ,happy worried
"i am happy, but marriage is a lot of responsibility.;;;;",i am happy but marriage is a lot of responsibility ,happy marriage lot responsibility
"yes, you have to take care of your wife.;;;;",yes you have to take care of your wife ,yes take care wife
and i have to take care of our children.;;;;,and i have to take care of our children ,take care children
are you going to start a family?;;;;,are you going to start a family ,going start family
yes. we want to have a little boy and a little girl.;;;;,yes we want to have a little boy and a little girl ,yes want little boy little girl
that sounds wonderful.;;;;,that sounds wonderful ,sounds wonderful
