text,cleaned,preprocessed
"i'm going to the store, would you like any pepto bismol?;;;;",i m going to the store would you like any pepto bismol ,going store would like pepto bismol
that's okay.;;;;,that s okay ,okay
did you hear the good news?;;;;,did you hear the good news ,hear good news
"no, i haven't.;;;;",no i haven t ,
i got a promotion at my job.;;;;,i got a promotion at my job ,got promotion job
did you really?;;;;,did you really ,really
"seriously, i am so excited.;;;;",seriously i am so excited ,seriously excited
"well, congratulations.;;;;",well congratulations ,well congratulations
thank you.;;;;,thank you ,thank
i'm so happy for you.;;;;,i m so happy for you ,happy
really?;;;;,really ,really
yes. you really deserved this.;;;;,yes you really deserved this ,yes really deserved
you think so?;;;;,you think so ,think
have you heard my good news?;;;;,have you heard my good news ,heard good news
you haven't told me anything yet.;;;;,you haven t told me anything yet ,told anything yet
i got a promotion at work earlier this week.;;;;,i got a promotion at work earlier this week ,got promotion work earlier week
is that right?;;;;,is that right ,right
it's the truth. i am really happy.;;;;,it s the truth i am really happy ,truth really happy
congratulations on your promotion.;;;;,congratulations on your promotion ,congratulations promotion
thank you very much.;;;;,thank you very much ,thank much
i am really excited for you.;;;;,i am really excited for you ,really excited
are you really?;;;;,are you really ,really
i'm serious. you deserved this promotion.;;;;,i m serious you deserved this promotion ,serious deserved promotion
is that what you really think?;;;;,is that what you really think ,really think
"i haven't told you what happened yet, have i?;;;;",i haven t told you what happened yet have i ,told happened yet
i haven't heard anything.;;;;,i haven t heard anything ,heard anything
"my boss offered me a promotion, and i took it.;;;;",my boss offered me a promotion and i took it ,boss offered promotion took
are you serious?;;;;,are you serious ,serious
"yes, i am really excited.;;;;",yes i am really excited ,yes really excited
that's great. congratulations.;;;;,that s great congratulations ,great congratulations
i appreciate that.;;;;,i appreciate that ,appreciate
you have no idea how happy i am for you.;;;;,you have no idea how happy i am for you ,idea happy
you look really nice today. ;;;;,you look really nice today ,look really nice today
thank you. i just got this outfit the other day.;;;;,thank you i just got this outfit the other day ,thank got outfit day
"really, where did you get it?;;;;",really where did you get it ,really get
i got it from macy's.;;;;,i got it from macy s ,got macy
it's really nice.;;;;,it s really nice ,really nice
"thanks again. you look nice today, too.;;;;",thanks again you look nice today too ,thanks look nice today
thank you. i just got these shoes today.;;;;,thank you i just got these shoes today ,thank got shoes today
really? what kind of shoes are they?;;;;,really what kind of shoes are they ,really kind shoes
these are called all star chuck taylors.;;;;,these are called all star chuck taylors ,called star chuck taylors
i really like those. how much did they cost?;;;;,i really like those how much did they cost ,really like much cost
they were about forty dollars.;;;;,they were about forty dollars ,forty dollars
i absolutely love what you're wearing today.;;;;,i absolutely love what you re wearing today ,absolutely love wearing today
you do? i just bought this outfit a couple days ago.;;;;,you do i just bought this outfit a couple days ago ,bought outfit couple days ago
"seriously, it looks really nice on you. where did you buy it from?;;;;",seriously it looks really nice on you where did you buy it from ,seriously looks really nice buy
i bought it from the macy's at the santa anita mall.;;;;,i bought it from the macy s at the santa anita mall ,bought macy santa anita mall
i really like that outfit.;;;;,i really like that outfit ,really like outfit
"thanks. i think you look nice today, too.;;;;",thanks i think you look nice today too ,thanks think look nice today
thank you. i just bought these new shoes earlier today.;;;;,thank you i just bought these new shoes earlier today ,thank bought new shoes earlier today
those are nice. what are they?;;;;,those are nice what are they ,nice
these are some chucks.;;;;,these are some chucks ,chucks
those are great. how much were they?;;;;,those are great how much were they ,great much
i got them for forty.;;;;,i got them for forty ,got forty
i think that you look very cute today.;;;;,i think that you look very cute today ,think look cute today
is that right? this is a brand new outfit.;;;;,is that right this is a brand new outfit ,right brand new outfit
what store did you get it from?;;;;,what store did you get it from ,store get
i went to macy's and picked it out.;;;;,i went to macy s and picked it out ,went macy picked
i love your outfit right now.;;;;,i love your outfit right now ,love outfit right
"well, i think you look nice today too.;;;;",well i think you look nice today too ,well think look nice today
thanks. i found these new shoes earlier at the store.;;;;,thanks i found these new shoes earlier at the store ,thanks found new shoes earlier store
i think that those are some really nice shoes. what kind are they?;;;;,i think that those are some really nice shoes what kind are they ,think really nice shoes kind
these are chucks.;;;;,these are chucks ,chucks
your shoes look really nice. how much did you get them for?;;;;,your shoes look really nice how much did you get them for ,shoes look really nice much get
"tell me, what do you enjoy doing in your spare time?;;;;",tell me what do you enjoy doing in your spare time ,tell enjoy spare time
i enjoy drawing and painting.;;;;,i enjoy drawing and painting ,enjoy drawing painting
you know how to draw and paint?;;;;,you know how to draw and paint ,know draw paint
"yes, i do.;;;;",yes i do ,yes
when did you learn how to do that?;;;;,when did you learn how to do that ,learn
i learned back in high school.;;;;,i learned back in high school ,learned back high school
"oh, so you took an art class?;;;;",oh so you took an art class ,oh took art class
"yeah, i loved that class.;;;;",yeah i loved that class ,yeah loved class
i see that you're pretty talented.;;;;,i see that you re pretty talented ,see pretty talented
thank you very much.;;;;,thank you very much ,thank much
i wish i had a talent like that.;;;;,i wish i had a talent like that ,wish talent like
what kinds of things do you like to do?;;;;,what kinds of things do you like to do ,kinds things like
i've always liked to draw and paint.;;;;,i ve always liked to draw and paint ,always liked draw paint
i didn't know you knew how to draw and paint.;;;;,i didn t know you knew how to draw and paint ,know knew draw paint
i do it every once in a while.;;;;,i do it every once in a while ,every
how long have you known how to do that?;;;;,how long have you known how to do that ,long known
i first learned how to do it in high school.;;;;,i first learned how to do it in high school ,first learned high school
did you take some sort of art class or something?;;;;,did you take some sort of art class or something ,take sort art class something
that was my favorite class.;;;;,that was my favorite class ,favorite class
you have got to be talented.;;;;,you have got to be talented ,got talented
thanks.;;;;,thanks ,thanks
if only i was talented.;;;;,if only i was talented ,talented
are there any hobbies you do?;;;;,are there any hobbies you do ,hobbies
"when i have time, i sometimes draw and paint.;;;;",when i have time i sometimes draw and paint ,time sometimes draw paint
"oh, you actually do that?;;;;",oh you actually do that ,oh actually
"every so often, i do.;;;;",every so often i do ,every often
did you always know how to draw and paint?;;;;,did you always know how to draw and paint ,always know draw paint
i was taught in high school how to draw and paint.;;;;,i was taught in high school how to draw and paint ,taught high school draw paint
you had an art class?;;;;,you had an art class ,art class
"exactly, it was my favorite class.;;;;",exactly it was my favorite class ,exactly favorite class
"well, it's good that you're so talented.;;;;",well it s good that you re so talented ,well good talented
i appreciate that.;;;;,i appreciate that ,appreciate
what's your favorite movie?;;;;,what s your favorite movie ,favorite movie
my favorite movie is superbad.;;;;,my favorite movie is superbad ,favorite movie superbad
"oh, why is that?;;;;",oh why is that ,oh
it's the funniest movie that i've ever seen.;;;;,it s the funniest movie that i ve ever seen ,funniest movie ever seen
that's true. it is a very funny movie.;;;;,that s true it is a very funny movie ,true funny movie
you've seen it before? ;;;;,you ve seen it before ,seen
"yes, i saw that movie the first day it came out in theaters.;;;;",yes i saw that movie the first day it came out in theaters ,yes saw movie first day came theaters
didn't you laugh through the whole movie? i did.;;;;,didn t you laugh through the whole movie i did ,laugh whole movie
me too. that movie brought tears to my eyes.;;;;,me too that movie brought tears to my eyes ,movie brought tears eyes
mine too.;;;;,mine too ,mine
i have it on dvd at my house if you want to come over and watch it.;;;;,i have it on dvd at my house if you want to come over and watch it ,dvd house want come watch
which movie is your favorite to watch?;;;;,which movie is your favorite to watch ,movie favorite watch
"i have to say, my favorite movie is superbad.;;;;",i have to say my favorite movie is superbad ,say favorite movie superbad
is that right? why?;;;;,is that right why ,right
"honestly, it is one of the funniest movies i've seen in a long time.;;;;",honestly it is one of the funniest movies i ve seen in a long time ,honestly one funniest movies seen long time
you're right. that movie is hilarious.;;;;,you re right that movie is hilarious ,right movie hilarious
i didn't think you saw that movie.;;;;,i didn t think you saw that movie ,think saw movie
i went to see it the day it came out.;;;;,i went to see it the day it came out ,went see day came
i was laughing through the whole movie.;;;;,i was laughing through the whole movie ,laughing whole movie
"i couldn't help laughing, either. ;;;;",i couldn t help laughing either ,help laughing either
same here.;;;;,same here ,
i bought the movie. would you like to come to my house and watch it?;;;;,i bought the movie would you like to come to my house and watch it ,bought movie would like come house watch
"out of every movie that you've seen, which one is your favorite?;;;;",out of every movie that you ve seen which one is your favorite ,every movie seen one favorite
i'm going to have to say that superbad is the best movie ever.;;;;,i m going to have to say that superbad is the best movie ever ,going say superbad best movie ever
"you think so, how come?;;;;",you think so how come ,think come
"well, superbad is super funny.;;;;",well superbad is super funny ,well superbad super funny
"you're not lying, i found that movie absolutely hilarious.;;;;",you re not lying i found that movie absolutely hilarious ,lying found movie absolutely hilarious
i didn't know that you saw superbad before.;;;;,i didn t know that you saw superbad before ,know saw superbad
i made sure to be in line to see it the first day it came out.;;;;,i made sure to be in line to see it the first day it came out ,made sure line see first day came
i couldn't keep from laughing throughout the whole movie.;;;;,i couldn t keep from laughing throughout the whole movie ,keep laughing throughout whole movie
i was laughing hysterically the whole time; my stomach muscles hurt afterwards.;;;,i was laughing hysterically the whole time my stomach muscles hurt afterwards ,laughing hysterically whole time stomach muscles hurt afterwards
that's exactly how i felt.;;;;,that s exactly how i felt ,exactly felt
what type of music do you like to listen to?;;;;,what type of music do you like to listen to ,type music like listen
i like listening to different kinds of music.;;;;,i like listening to different kinds of music ,like listening different kinds music
"like what, for instance?;;;;",like what for instance ,like instance
i enjoy rock and r&b.;;;;,i enjoy rock and r b ,enjoy rock r b
why is that?;;;;,why is that ,
i like the different instruments that they use.;;;;,i like the different instruments that they use ,like different instruments use
that's a good reason to like something.;;;;,that s a good reason to like something ,good reason like something
what kind of music do you enjoy listening to?;;;;,what kind of music do you enjoy listening to ,kind music enjoy listening
i enjoy listening to all kinds of music.;;;;,i enjoy listening to all kinds of music ,enjoy listening kinds music
what kind?;;;;,what kind ,kind
i like to listen to rock and r&b.;;;;,i like to listen to rock and r b ,like listen rock r b
why do you like that type of music?;;;;,why do you like that type of music ,like type music
i like the kinds of instruments that they use.;;;;,i like the kinds of instruments that they use ,like kinds instruments use
i think that's an excellent reason to like something.;;;;,i think that s an excellent reason to like something ,think excellent reason like something
what is your favorite kind of music?;;;;,what is your favorite kind of music ,favorite kind music
i listen to various types of music.;;;;,i listen to various types of music ,listen various types music
what genres?;;;;,what genres ,genres
i enjoy listening to both rock and r&b.;;;;,i enjoy listening to both rock and r b ,enjoy listening rock r b
what interests you in that type of music?;;;;,what interests you in that type of music ,interests type music
i enjoy the different types of instruments that they use.;;;;,i enjoy the different types of instruments that they use ,enjoy different types instruments use
did you go to the basketball game on friday?;;;;,did you go to the basketball game on friday ,go basketball game friday
"no, i couldn't make it.;;;;",no i couldn t make it ,make
you missed a really good game.;;;;,you missed a really good game ,missed really good game
"oh, really? who won?;;;;",oh really who won ,oh really
our school did. they played really well.;;;;,our school did they played really well ,school played really well
too bad i was busy. i really wanted to go.;;;;,too bad i was busy i really wanted to go ,bad busy really wanted go
"yeah, you should have. it was really exciting.;;;;",yeah you should have it was really exciting ,yeah really exciting
so what was the score?;;;;,so what was the score ,score
the score was 101-98.;;;;,the score was ,score
"man, that was a really close game.;;;;",man that was a really close game ,man really close game
that's what made it so great.;;;;,that s what made it so great ,made great
were you able to attend friday night's basketball game?;;;;,were you able to attend friday night s basketball game ,able attend friday night basketball game
i was unable to make it.;;;;,i was unable to make it ,unable make
you should have been there. it was intense.;;;;,you should have been there it was intense ,intense
is that right. who ended up winning?;;;;,is that right who ended up winning ,right ended winning
our team was victorious.;;;;,our team was victorious ,team victorious
i wish i was free that night. i'm kind of mad that i didn't go.;;;;,i wish i was free that night i m kind of mad that i didn t go ,wish free night kind mad go
it was a great game.;;;;,it was a great game ,great game
what was the score at the end of the game?;;;;,what was the score at the end of the game ,score end game
our team won 101-98.;;;;,our team won ,team
sounds like it was a close game.;;;;,sounds like it was a close game ,sounds like close game
that's the reason it was such a great game.;;;;,that s the reason it was such a great game ,reason great game
i was meaning to ask you if you saw the basketball game on friday.;;;;,i was meaning to ask you if you saw the basketball game on friday ,meaning ask saw basketball game friday
"i wanted to go, but i couldn't.;;;;",i wanted to go but i couldn t ,wanted go
it was a great game.;;;;,it was a great game ,great game
it's too bad that i couldn't make it. who won?;;;;,it s too bad that i couldn t make it who won ,bad make
our team played hard and won.;;;;,our team played hard and won ,team played hard
i really wish i went to the game.;;;;,i really wish i went to the game ,really wish went game
it was the best game ever.;;;;,it was the best game ever ,best game ever
so tell me the final score.;;;;,so tell me the final score ,tell final score
"the other team lost by three points, 101-98. ;;;;",the other team lost by three points ,team lost three points
it must've been a close game.;;;;,it must ve been a close game ,must close game
what are you doing this weekend?;;;;,what are you doing this weekend ,weekend
i'm going to the movies with a friend. how about you?;;;;,i m going to the movies with a friend how about you ,going movies friend
i'm not sure yet.;;;;,i m not sure yet ,sure yet
"well, did you want to go see a movie with me?;;;;",well did you want to go see a movie with me ,well want go see movie
what movie are you going to see?;;;;,what movie are you going to see ,movie going see
i'm not sure yet. is there something you want to see?;;;;,i m not sure yet is there something you want to see ,sure yet something want see
there's nothing i can think of.;;;;,there s nothing i can think of ,nothing think
"so, did you want to go?;;;;",so did you want to go ,want go
"no, thanks, maybe another time.;;;;",no thanks maybe another time ,thanks maybe another time
do you know what you're going to do this weekend?;;;;,do you know what you re going to do this weekend ,know going weekend
i am going to see a movie with a friend of mine. what about you?;;;;,i am going to see a movie with a friend of mine what about you ,going see movie friend mine
i don't know.;;;;,i don t know ,know
would you like to see a movie with me and my friend?;;;;,would you like to see a movie with me and my friend ,would like see movie friend
do you know what movie you're going to watch?;;;;,do you know what movie you re going to watch ,know movie going watch
"i don't know, but was there a certain movie you wanted to see?;;;;",i don t know but was there a certain movie you wanted to see ,know certain movie wanted see
none that i can think of.;;;;,none that i can think of ,none think
"well, would you like to go?;;;;",well would you like to go ,well would like go
"thank you for inviting me, but i think i'll pass.;;;;",thank you for inviting me but i think i ll pass ,thank inviting think pass
you have any ideas as to what you want to do this weekend?;;;;,you have any ideas as to what you want to do this weekend ,ideas want weekend
i'm going to the movie theater with my friend. what are you going to do?;;;;,i m going to the movie theater with my friend what are you going to do ,going movie theater friend going
i'm not quite sure yet.;;;;,i m not quite sure yet ,quite sure yet
how about you see a movie with me and my friend?;;;;,how about you see a movie with me and my friend ,see movie friend
what movie are you and your friend planning on watching?;;;;,what movie are you and your friend planning on watching ,movie friend planning watching
not sure. is there a movie out that catches your eye?;;;;,not sure is there a movie out that catches your eye ,sure movie catches eye
no good movies come to mind.;;;;,no good movies come to mind ,good movies come mind
have you decided whether or not you would like to go?;;;;,have you decided whether or not you would like to go ,decided whether would like go
did you go to school today?;;;;,did you go to school today ,go school today
"yeah, i went to school today. were you there?;;;;",yeah i went to school today were you there ,yeah went school today
"no, i didn't go, i've been sick.;;;;",no i didn t go i ve been sick ,go sick
that sucks. did you want the assignments from english class?;;;;,that sucks did you want the assignments from english class ,sucks want assignments english class
"that would be nice, thank you.;;;;",that would be nice thank you ,would nice thank
"no problem, you're welcome.;;;;",no problem you re welcome ,problem welcome
i will be glad to do the same for you when you're sick.;;;;,i will be glad to do the same for you when you re sick ,glad sick
have you attended school today?;;;;,have you attended school today ,attended school today
i attended school today. did you?;;;;,i attended school today did you ,attended school today
i wasn't able to attend school because i was feeling ill.;;;;,i wasn t able to attend school because i was feeling ill ,able attend school feeling ill
i'm sorry to hear that. would you like the assignments from english class?;;;;,i m sorry to hear that would you like the assignments from english class ,sorry hear would like assignments english class
"i would really appreciate that, thanks.;;;;",i would really appreciate that thanks ,would really appreciate thanks
it's no trouble at all.;;;;,it s no trouble at all ,trouble
"if you get sick, i'll return the favor.;;;;",if you get sick i ll return the favor ,get sick return favor
have you gone to school today?;;;;,have you gone to school today ,gone school today
i went to school today. did you go to school?;;;;,i went to school today did you go to school ,went school today go school
"i couldn't go to school today, i was sick.;;;;",i couldn t go to school today i was sick ,go school today sick
that's horrible. i'd be happy to give you the assignments from english class.;;;;,that s horrible i d be happy to give you the assignments from english class ,horrible happy give assignments english class
"thank you very much, that's kind of you.;;;;",thank you very much that s kind of you ,thank much kind
don't mention it.;;;;,don t mention it ,mention
did you hear the news?;;;;,did you hear the news ,hear news
what happened?;;;;,what happened ,happened
our cousin went into labor and had her baby last week.;;;;,our cousin went into labor and had her baby last week ,cousin went labor baby last week
she did? why didn't anyone tell me?;;;;,she did why didn t anyone tell me ,anyone tell
i would've thought that somebody would have told you.;;;;,i would ve thought that somebody would have told you ,would thought somebody would told
"no, i had no idea.;;;;",no i had no idea ,idea
"well, she did, her baby was 8 pounds 6 ounces.;;;;",well she did her baby was pounds ounces ,well baby pounds ounces
"oh my god, that's great!;;;;",oh my god that s great ,oh god great
are you going to go and visit her and the baby?;;;;,are you going to go and visit her and the baby ,going go visit baby
i think that i might.;;;;,i think that i might ,think might
good! i just thought i'd let you know.;;;;,good i just thought i d let you know ,good thought let know
have you heard what happened?;;;;,have you heard what happened ,heard happened
heard what?;;;;,heard what ,heard
debrah already had her baby.;;;;,debrah already had her baby ,debrah already baby
i didn't know that.;;;;,i didn t know that ,know
i thought you knew.;;;;,i thought you knew ,thought knew
i honestly didn't know.;;;;,i honestly didn t know ,honestly know
the baby was 8 pounds 6 ounces.;;;;,the baby was pounds ounces ,baby pounds ounces
that's good to hear.;;;;,that s good to hear ,good hear
will you go and visit them?;;;;,will you go and visit them ,go visit
of course i will.;;;;,of course i will ,course
i just wanted to give you the good news.;;;;,i just wanted to give you the good news ,wanted give good news
have you heard the news?;;;;,have you heard the news ,heard news
i haven't heard anything.;;;;,i haven t heard anything ,heard anything
debrah had her baby last week.;;;;,debrah had her baby last week ,debrah baby last week
nobody told me.;;;;,nobody told me ,nobody told
i thought you heard.;;;;,i thought you heard ,thought heard
i really wasn't told anything.;;;;,i really wasn t told anything ,really told anything
she was a cute 8 pounds 6 ounces.;;;;,she was a cute pounds ounces ,cute pounds ounces
"wow, how exciting.;;;;",wow how exciting ,wow exciting
"i know, you should really go and see her and the baby.;;;;",i know you should really go and see her and the baby ,know really go see baby
of course i will.;;;;,of course i will ,course
did you go to school today?;;;;,did you go to school today ,go school today
of course. did you?;;;;,of course did you ,course
"i didn't want to, so i didn't.;;;;",i didn t want to so i didn t ,want
"that's sad, but have you gone to the movies recently?;;;;",that s sad but have you gone to the movies recently ,sad gone movies recently
that's a switch.;;;;,that s a switch ,switch
"i'm serious, have you?;;;;",i m serious have you ,serious
"no, i haven't. why?;;;;",no i haven t why ,
i really want to go to the movies this weekend.;;;;,i really want to go to the movies this weekend ,really want go movies weekend
so go then.;;;;,so go then ,go
i really don't want to go by myself.;;;;,i really don t want to go by myself ,really want go
"well anyway, do you plan on going to school tomorrow?;;;;",well anyway do you plan on going to school tomorrow ,well anyway plan going school tomorrow
did you make it to school today?;;;;,did you make it to school today ,make school today
i always do. did you go to school today?;;;;,i always do did you go to school today ,always go school today
"no, i didn't.;;;;",no i didn t ,
"you should have, but have you seen any movies lately?;;;;",you should have but have you seen any movies lately ,seen movies lately
that was an odd change of subject.;;;;,that was an odd change of subject ,odd change subject
