text,cleaned,preprocessed
i like this hotel.;;;;,i like this hotel ,like hotel
what do you like about it?;;;;,what do you like about it ,like
we get a free breakfast.;;;;,we get a free breakfast ,get free breakfast
coffee and a roll?;;;;,coffee and a roll ,coffee roll
"no, a real breakfast.;;;;",no a real breakfast ,real breakfast
bacon and eggs?;;;;,bacon and eggs ,bacon eggs
"with toast, ham, sausage, fresh fruit, and juice.;;;;",with toast ham sausage fresh fruit and juice ,toast ham sausage fresh fruit juice
wow! that is nice. let's stay for two nights.;;;;,wow that is nice let s stay for two nights ,wow nice let stay two nights
"and the rooms are clean, too.;;;;",and the rooms are clean too ,rooms clean
do they allow pets?;;;;,do they allow pets ,allow pets
"no pets, no smoking.;;;;",no pets no smoking ,pets smoking
i'm not sleeping here tonight.;;;;,i m not sleeping here tonight ,sleeping tonight
what's the matter? this is a nice room.;;;;,what s the matter this is a nice room ,matter nice room
"maybe the room is nice, but not the bed.;;;;",maybe the room is nice but not the bed ,maybe room nice bed
what's wrong with the bed?;;;;,what s wrong with the bed ,wrong bed
look at this sheet.;;;;,look at this sheet ,look sheet
yes?;;;;,yes ,yes
see those stains?;;;;,see those stains ,see stains
i sure do.;;;;,i sure do ,sure
i'm not sleeping on that sheet.;;;;,i m not sleeping on that sheet ,sleeping sheet
"well, just call the front desk. they'll give us new sheets.;;;;",well just call the front desk they ll give us new sheets ,well call front desk give us new sheets
i want sheets without stains on them.;;;;,i want sheets without stains on them ,want sheets without stains
what time does your plane leave?;;;;,what time does your plane leave ,time plane leave
it leaves at 12:15.;;;;,it leaves at ,leaves
when do you have to be at the airport?;;;;,when do you have to be at the airport ,airport
i have to be there two hours early.;;;;,i have to be there two hours early ,two hours early
so we have to be at the airport at 10:15.;;;;,so we have to be at the airport at ,airport
that means we have to leave the house at 9:15.;;;;,that means we have to leave the house at ,means leave house
"well, it's an hour to get there, if there are no traffic problems.;;;;",well it s an hour to get there if there are no traffic problems ,well hour get traffic problems
so maybe we better leave at 8:15?;;;;,so maybe we better leave at ,maybe better leave
"yes, it's better to get there too early than too late.;;;;",yes it s better to get there too early than too late ,yes better get early late
i agree.;;;;,i agree ,agree
you never know what might happen on these freeways.;;;;,you never know what might happen on these freeways ,never know might happen freeways
i need to fly to new york.;;;;,i need to fly to new york ,need fly new york
when are you going?;;;;,when are you going ,going
during the christmas holidays.;;;;,during the christmas holidays ,christmas holidays
you'd better buy your ticket now.;;;;,you d better buy your ticket now ,better buy ticket
you must be kidding.;;;;,you must be kidding ,must kidding
"no, i'm not. it's march. time is running out. seats are selling out right now.;;;;",no i m not it s march time is running out seats are selling out right now ,march time running seats selling right
i thought i would wait until october.;;;;,i thought i would wait until october ,thought would wait october
i'll bet this is the first time you've ever flown during christmas.;;;;,i ll bet this is the first time you ve ever flown during christmas ,bet first time ever flown christmas
you're right.;;;;,you re right ,right
"well, listen to me. you need to buy a ticket now.;;;;",well listen to me you need to buy a ticket now ,well listen need buy ticket
but maybe prices will be cheaper in october.;;;;,but maybe prices will be cheaper in october ,maybe prices cheaper october
i hate flying.;;;;,i hate flying ,hate flying
so do i.;;;;,so do i ,
"a long time ago, flying used to be okay.;;;;",a long time ago flying used to be okay ,long time ago flying used okay
now it's like riding a bus.;;;;,now it s like riding a bus ,like riding bus
you're jammed in with people all around you.;;;;,you re jammed in with people all around you ,jammed people around
"half of them are coughing, and the other half are sneezing.;;;;",half of them are coughing and the other half are sneezing ,half coughing half sneezing
you don't have any elbow room or knee room.;;;;,you don t have any elbow room or knee room ,elbow room knee room
people are always getting up to use the bathroom.;;;;,people are always getting up to use the bathroom ,people always getting use bathroom
kids are crying or climbing over you.;;;;,kids are crying or climbing over you ,kids crying climbing
it's a flying zoo!;;;;,it s a flying zoo ,flying zoo
i wish i could afford first class seats.;;;;,i wish i could afford first class seats ,wish could afford first class seats
some guy rowed across the atlantic ocean.;;;;,some guy rowed across the atlantic ocean ,guy rowed across atlantic ocean
good for him.;;;;,good for him ,good
why would he do that?;;;;,why would he do that ,would
did he set a new record?;;;;,did he set a new record ,set new record
"yes, i think he did.;;;;",yes i think he did ,yes think
"well, i guess that's why he did it.;;;;",well i guess that s why he did it ,well guess
what's the point?;;;;,what s the point ,point
now he has the world record!;;;;,now he has the world record ,world record
"but someone's going to break it, so what good is it?;;;;",but someone s going to break it so what good is it ,someone going break good
"well, he can enjoy it while it lasts.;;;;",well he can enjoy it while it lasts ,well enjoy lasts
i don't think he even got paid for it.;;;;,i don t think he even got paid for it ,think even got paid
i want to go on a cruise ship.;;;;,i want to go on a cruise ship ,want go cruise ship
that sounds like fun. where do you want to go?;;;;,that sounds like fun where do you want to go ,sounds like fun want go
i want to cruise to hawaii.;;;;,i want to cruise to hawaii ,want cruise hawaii
"that should be a nice trip. lots of fun, and lots of food.;;;;",that should be a nice trip lots of fun and lots of food ,nice trip lots fun lots food
i have no idea how much it will cost.;;;;,i have no idea how much it will cost ,idea much cost
i think it depends on the season and on your cabin.;;;;,i think it depends on the season and on your cabin ,think depends season cabin
"well, of course i want to go when the weather is nice.;;;;",well of course i want to go when the weather is nice ,well course want go weather nice
"yes, you don't want to travel in winter storms.;;;;",yes you don t want to travel in winter storms ,yes want travel winter storms
and i want to get a big cabin with a view.;;;;,and i want to get a big cabin with a view ,want get big cabin view
are you going to travel alone?;;;;,are you going to travel alone ,going travel alone
"no, my sister and i will travel together.;;;;",no my sister and i will travel together ,sister travel together
i hate to fly.;;;;,i hate to fly ,hate fly
because of all the security?;;;;,because of all the security ,security
"no, because it hurts my ears.;;;;",no because it hurts my ears ,hurts ears
what do you mean?;;;;,what do you mean ,mean
"every time we land or take off, my ears hurt so much.;;;;",every time we land or take off my ears hurt so much ,every time land take ears hurt much
"that's just the altitude change, i think.;;;;",that s just the altitude change i think ,altitude change think
"whatever it is, it hurts.;;;;",whatever it is it hurts ,whatever hurts
can't you take medicine or something for it?;;;;,can t you take medicine or something for it ,take medicine something
"i've tried everything, but nothing works.;;;;",i ve tried everything but nothing works ,tried everything nothing works
have you tried earplugs?;;;;,have you tried earplugs ,tried earplugs
"they don't work, either.;;;;",they don t work either ,work either
spring break starts tomorrow.;;;;,spring break starts tomorrow ,spring break starts tomorrow
are you going to go anywhere?;;;;,are you going to go anywhere ,going go anywhere
i was thinking of driving to arizona.;;;;,i was thinking of driving to arizona ,thinking driving arizona
to the grand canyon?;;;;,to the grand canyon ,grand canyon
yes. i've never been there.;;;;,yes i ve never been there ,yes never
i was there when i was a kid.;;;;,i was there when i was a kid ,kid
how did you like it?;;;;,how did you like it ,like
i loved it. i still remember how amazing it was.;;;;,i loved it i still remember how amazing it was ,loved still remember amazing
"i'm sure i'll like it, too.;;;;",i m sure i ll like it too ,sure like
you should try riding a mule on a trail to the bottom.;;;;,you should try riding a mule on a trail to the bottom ,try riding mule trail bottom
no way! i don't want to fall to my death.;;;;,no way i don t want to fall to my death ,way want fall death
that hotel was terrible.;;;;,that hotel was terrible ,hotel terrible
the worst in the whole world.;;;;,the worst in the whole world ,worst whole world
the walls were so thin.;;;;,the walls were so thin ,walls thin
all day long we heard tvs or telephones.;;;;,all day long we heard tvs or telephones ,day long heard tvs telephones
all night long we heard people snoring.;;;;,all night long we heard people snoring ,night long heard people snoring
housekeeping didn't give us fresh towels.;;;;,housekeeping didn t give us fresh towels ,housekeeping give us fresh towels
room service brought us a cold dinner.;;;;,room service brought us a cold dinner ,room service brought us cold dinner
our nonsmoking room stunk of cigarette smoke.;;;;,our nonsmoking room stunk of cigarette smoke ,nonsmoking room stunk cigarette smoke
our room was right next to the elevator and the ice machine.;;;;,our room was right next to the elevator and the ice machine ,room right next elevator ice machine
they added phony charges to our bill.;;;;,they added phony charges to our bill ,added phony charges bill
how did we end up in that terrible hotel?;;;;,how did we end up in that terrible hotel ,end terrible hotel
i have to hang up. i'm so sleepy.;;;;,i have to hang up i m so sleepy ,hang sleepy
it's not even 10 o'clock.;;;;,it s not even o clock ,even clock
i'm falling asleep on the phone.;;;;,i m falling asleep on the phone ,falling asleep phone
you got up real early.;;;;,you got up real early ,got real early
i had to take my friend to the airport.;;;;,i had to take my friend to the airport ,take friend airport
why didn't you take a nap when you got home?;;;;,why didn t you take a nap when you got home ,take nap got home
i didn't get home until 30 minutes ago.;;;;,i didn t get home until minutes ago ,get home minutes ago
why is that?;;;;,why is that ,
there was a bomb threat at the airport.;;;;,there was a bomb threat at the airport ,bomb threat airport
only a threat?;;;;,only a threat ,threat
"yes, but i was stuck there all day while they looked for the bomb.;;;;",yes but i was stuck there all day while they looked for the bomb ,yes stuck day looked bomb
"my dad went to washington, d.c.;;;;",my dad went to washington d c ,dad went washington c
why did he do that?;;;;,why did he do that ,
"he was invited, along with about 90 other veterans.;;;;",he was invited along with about other veterans ,invited along veterans
who invited them?;;;;,who invited them ,invited
some private organization.;;;;,some private organization ,private organization
why did they invite him?;;;;,why did they invite him ,invite
to thank him and all the other soldiers who served in world war ii.;;;;,to thank him and all the other soldiers who served in world war ii ,thank soldiers served world war ii
that's very nice.;;;;,that s very nice ,nice
my dad got to see the beautiful new world war ii monument.;;;;,my dad got to see the beautiful new world war ii monument ,dad got see beautiful new world war ii monument
that trip must have cost a lot of money. ;;;;,that trip must have cost a lot of money ,trip must cost lot money
"that was a great trip to washington, d.c.;;;;",that was a great trip to washington d c ,great trip washington c
"tell me about it, dad.;;;;",tell me about it dad ,tell dad
about 90 of us world war ii veterans got on the plane at 8 a.m.;;;;,about of us world war ii veterans got on the plane at a m ,us world war ii veterans got plane
how long was the flight?;;;;,how long was the flight ,long flight
it only took about two hours.;;;;,it only took about two hours ,took two hours
did you take pictures at the world war ii monument?;;;;,did you take pictures at the world war ii monument ,take pictures world war ii monument
"oh, yes. we all took lots of pictures.;;;;",oh yes we all took lots of pictures ,oh yes took lots pictures
then you flew back home that evening?;;;;,then you flew back home that evening ,flew back home evening
"yes. when we landed, tv reporters and the army band were there.;;;;",yes when we landed tv reporters and the army band were there ,yes landed tv reporters army band
that must have made you feel really special.;;;;,that must have made you feel really special ,must made feel really special
"oh, it did. there were about 300 people there to honor us.;;;;",oh it did there were about people there to honor us ,oh people honor us
i need a job.;;;;,i need a job ,need job
i thought you had a job.;;;;,i thought you had a job ,thought job
i did.;;;;,i did ,
what happened?;;;;,what happened ,happened
i got laid off.;;;;,i got laid off ,got laid
that's terrible! when did it happen?;;;;,that s terrible when did it happen ,terrible happen
i got laid off last week.;;;;,i got laid off last week ,got laid last week
just you?;;;;,just you ,
"no, ten of my coworkers got laid off, too.;;;;",no ten of my coworkers got laid off too ,ten coworkers got laid
what are you going to do?;;;;,what are you going to do ,going
i'm looking in the newspaper for a job.;;;;,i m looking in the newspaper for a job ,looking newspaper job
"before you go to that interview, check yourself.;;;;",before you go to that interview check yourself ,go interview check
what's to check?;;;;,what s to check ,check
are your nails clean?;;;;,are your nails clean ,nails clean
"yes, they are.;;;;",yes they are ,yes
did you double-check your nose and teeth?;;;;,did you double check your nose and teeth ,double check nose teeth
"they are clean, too.;;;;",they are clean too ,clean
did you shine your shoes?;;;;,did you shine your shoes ,shine shoes
my shoes are shined.;;;;,my shoes are shined ,shoes shined
do your socks match?;;;;,do your socks match ,socks match
of course they match.;;;;,of course they match ,course match
"no, they don't. one is black and one is dark blue.;;;;",no they don t one is black and one is dark blue ,one black one dark blue
life is hard.;;;;,life is hard ,life hard
it sure is.;;;;,it sure is ,sure
i thought school was hard.;;;;,i thought school was hard ,thought school hard
"me, too. i couldn't wait to graduate.;;;;",me too i couldn t wait to graduate ,wait graduate
"but now work is hard, too.;;;;",but now work is hard too ,work hard
i agree. work is just as hard as school.;;;;,i agree work is just as hard as school ,agree work hard school
sometimes i wish i was back in school.;;;;,sometimes i wish i was back in school ,sometimes wish back school
"me, too. school was fun.;;;;",me too school was fun ,school fun
and it was only 12 years.;;;;,and it was only years ,years
it went by pretty fast.;;;;,it went by pretty fast ,went pretty fast
but work goes on forever!;;;;,but work goes on forever ,work goes forever
i'm sleepy.;;;;,i m sleepy ,sleepy
so am i.;;;;,so am i ,
i had a long day.;;;;,i had a long day ,long day
so did i.;;;;,so did i ,
i didn't even have lunch.;;;;,i didn t even have lunch ,even lunch
neither did i.;;;;,neither did i ,neither
i was busy the whole day.;;;;,i was busy the whole day ,busy whole day
so was i.;;;;,so was i ,
i had to bring work home with me.;;;;,i had to bring work home with me ,bring work home
i did too.;;;;,i did too ,
your day was just like mine.;;;;,your day was just like mine ,day like mine
i don't like my job.;;;;,i don t like my job ,like job
what do you do?;;;;,what do you do ,
i'm a babysitter.;;;;,i m a babysitter ,babysitter
is that a lot of work?;;;;,is that a lot of work ,lot work
babies cry all the time.;;;;,babies cry all the time ,babies cry time
you have to change their diapers.;;;;,you have to change their diapers ,change diapers
i have to feed them.;;;;,i have to feed them ,feed
are you looking for another job?;;;;,are you looking for another job ,looking another job
"no, i'm looking for another family.;;;;",no i m looking for another family ,looking another family
another family?;;;;,another family ,another family
a family with only one baby.;;;;,a family with only one baby ,family one baby
i need a job.;;;;,i need a job ,need job
what was your last job?;;;;,what was your last job ,last job
i was a painter.;;;;,i was a painter ,painter
what happened?;;;;,what happened ,happened
i got laid off because there was no work.;;;;,i got laid off because there was no work ,got laid work
what else can you do?;;;;,what else can you do ,else
i'm a handyman.;;;;,i m a handyman ,handyman
can you fix a dripping faucet in a kitchen sink?;;;;,can you fix a dripping faucet in a kitchen sink ,fix dripping faucet kitchen sink
of course.;;;;,of course ,course
then i have a job for you in my kitchen.;;;;,then i have a job for you in my kitchen ,job kitchen
it will cost you only $20 plus parts.;;;;,it will cost you only plus parts ,cost plus parts
what would you do if you lost your job?;;;;,what would you do if you lost your job ,would lost job
i have no idea. i've been here for 20 years.;;;;,i have no idea i ve been here for years ,idea years
do you have any other skills?;;;;,do you have any other skills ,skills
"well, i know how to flip hamburgers.;;;;",well i know how to flip hamburgers ,well know flip hamburgers
no one would hire you to flip hamburgers.;;;;,no one would hire you to flip hamburgers ,one would hire flip hamburgers
have you heard something that you're not telling me?;;;;,have you heard something that you re not telling me ,heard something telling
what do you mean?;;;;,what do you mean ,mean
are there going to be layoffs at this place?;;;;,are there going to be layoffs at this place ,going layoffs place
i certainly hope not!;;;;,i certainly hope not ,certainly hope
"if you got laid off, you'd be flipping hamburgers, too.;;;;",if you got laid off you d be flipping hamburgers too ,got laid flipping hamburgers
"oh great, we could both work at burger king.;;;;",oh great we could both work at burger king ,oh great could work burger king
do your students ever talk about their jobs?;;;;,do your students ever talk about their jobs ,students ever talk jobs
"yes, and they ask me what jobs are the best.;;;;",yes and they ask me what jobs are the best ,yes ask jobs best
i tell my students to become a teacher.;;;;,i tell my students to become a teacher ,tell students become teacher
teaching is a great job.;;;;,teaching is a great job ,teaching great job
it's the best job i've ever had.;;;;,it s the best job i ve ever had ,best job ever
what makes it so good?;;;;,what makes it so good ,makes good
"for me, it's the students.;;;;",for me it s the students ,students
what do you mean?;;;;,what do you mean ,mean
i mean i have wonderful students.;;;;,i mean i have wonderful students ,mean wonderful students
that must be nice.;;;;,that must be nice ,must nice
teaching is the best part of my whole day.;;;;,teaching is the best part of my whole day ,teaching best part whole day
"boy, i'm glad that job is finished.;;;;",boy i m glad that job is finished ,boy glad job finished
how long did it take?;;;;,how long did it take ,long take
"four hours, without a break.;;;;",four hours without a break ,four hours without break
it's always nice to finish a job.;;;;,it s always nice to finish a job ,always nice finish job
"well, it's good and bad.;;;;",well it s good and bad ,well good bad
what's bad about it?;;;;,what s bad about it ,bad
"when you finish, all you do is start another job!;;;;",when you finish all you do is start another job ,finish start another job
"yes, that's right. it does get boring.;;;;",yes that s right it does get boring ,yes right get boring
"especially if it's the same work, over and over.;;;;",especially if it s the same work over and over ,especially work
but that's what most people do.;;;;,but that s what most people do ,people
"yes, i guess most of us are stuck in a routine.;;;;",yes i guess most of us are stuck in a routine ,yes guess us stuck routine
i think i have the worst boss in the world.;;;;,i think i have the worst boss in the world ,think worst boss world
what makes him so bad?;;;;,what makes him so bad ,makes bad
he's rude and he yells a lot.;;;;,he s rude and he yells a lot ,rude yells lot
that's hard to take.;;;;,that s hard to take ,hard take
i've never heard him say please or thank you.;;;;,i ve never heard him say please or thank you ,never heard say please thank
he sounds like a real jerk.;;;;,he sounds like a real jerk ,sounds like real jerk
no one at work likes him.;;;;,no one at work likes him ,one work likes
can't you report him to his supervisor?;;;;,can t you report him to his supervisor ,report supervisor
"of course not. if i do that, i'll lose my job.;;;;",of course not if i do that i ll lose my job ,course lose job
"yes, they don't like troublemakers or complainers.;;;;",yes they don t like troublemakers or complainers ,yes like troublemakers complainers
"i can't quit, because i'm making a good salary.;;;;",i can t quit because i m making a good salary ,quit making good salary
what are we going to do?;;;;,what are we going to do ,going
about what?;;;;,about what ,
about finding a job for me.;;;;,about finding a job for me ,finding job
you don't need a job. i make enough money for both of us.;;;;,you don t need a job i make enough money for both of us ,need job make enough money us
that doesn't matter. i don't want to sit around.;;;;,that doesn t matter i don t want to sit around ,matter want sit around
"okay, what kind of job do you want?;;;;",okay what kind of job do you want ,okay kind job want
i'm not sure.;;;;,i m not sure ,sure
"well, you should do something that you enjoy.;;;;",well you should do something that you enjoy ,well something enjoy
i enjoy selling. i was born to sell.;;;;,i enjoy selling i was born to sell ,enjoy selling born sell
"okay, what do you want to sell?;;;;",okay what do you want to sell ,okay want sell
cigarette lighters. i'll make a fortune.;;;;,cigarette lighters i ll make a fortune ,cigarette lighters make fortune
a new hotel is looking for workers.;;;;,a new hotel is looking for workers ,new hotel looking workers
"yes, i saw it on the tv news.;;;;",yes i saw it on the tv news ,yes saw tv news
they need 300 new workers.;;;;,they need new workers ,need new workers
"and 4,000 people showed up.;;;;",and people showed up ,people showed
so many people are out of work.;;;;,so many people are out of work ,many people work
"i still have my job, thank goodness.;;;;",i still have my job thank goodness ,still job thank goodness
"so do i, but i'm worried.;;;;",so do i but i m worried ,worried
me too. there are no guarantees.;;;;,me too there are no guarantees ,guarantees
"if you lose your job, you can move in with me.;;;;",if you lose your job you can move in with me ,lose job move
"oh, thank you. that's very nice of you.;;;;",oh thank you that s very nice of you ,oh thank nice
you would do the same for me.;;;;,you would do the same for me ,would
i think i did something real stupid.;;;;,i think i did something real stupid ,think something real stupid
what did you do?;;;;,what did you do ,
i bought some stock.;;;;,i bought some stock ,bought stock
everybody buys stock.;;;;,everybody buys stock ,everybody buys stock
i bought it on a hunch.;;;;,i bought it on a hunch ,bought hunch
you didn't read about the company first?;;;;,you didn t read about the company first ,read company first
i didn't have to. it's been in business for 60 years.;;;;,i didn t have to it s been in business for years ,business years
so what's the problem?;;;;,so what s the problem ,problem
i used all my savings on this one company.;;;;,i used all my savings on this one company ,used savings one company
you put all your eggs into one basket.;;;;,you put all your eggs into one basket ,put eggs one basket
"if the company goes out of business, i'll have nothing.;;;;",if the company goes out of business i ll have nothing ,company goes business nothing
i was going to be a doctor.;;;;,i was going to be a doctor ,going doctor
what happened to your plans?;;;;,what happened to your plans ,happened plans
i got a d in college chemistry.;;;;,i got a d in college chemistry ,got college chemistry
"well, a d is better than an f.;;;;",well a d is better than an f ,well better f
a tutor helped me get the d!;;;;,a tutor helped me get the d ,tutor helped get
"so, you didn't become a doctor.;;;;",so you didn t become a doctor ,become doctor
and now i'm glad that i didn't.;;;;,and now i m glad that i didn t ,glad
why's that?;;;;,why s that ,
a hospital is the most dangerous place in the world.;;;;,a hospital is the most dangerous place in the world ,hospital dangerous place world
"oh, yes, because of all the killer germs.;;;;",oh yes because of all the killer germs ,oh yes killer germs
"if you're a smart doctor, you stay away from hospitals.;;;;",if you re a smart doctor you stay away from hospitals ,smart doctor stay away hospitals
i want to be a mail carrier when i grow up.;;;;,i want to be a mail carrier when i grow up ,want mail carrier grow
why?;;;;,why ,
because you get to meet a lot of people.;;;;,because you get to meet a lot of people ,get meet lot people
